#\China\AOG.txt;;;;;;;;;;;X;
EVT_900011_OPTIONB;They are fellow Chinese same as us, there must be a way for peace!;;;;;;;;;;X;Они такие же китайцы как мы, должен быть мирный путь решения проблемы!
EVT_900011_OPTIONC;We are in no shape for a reunification war yet.;;;;;;;;;;X;Мы не готовы начать войну
EVT_900012_NAME;Move into Southern regions;;;;;;;;;;X;Экспансия в южные регионы
EVT_900012_DESC;With our recent victory over the pathetic Qing Empire, we now must find ways to continue driving the foreigners out of China! Word has reached us that the German-backed AOG in Southern China is currently facing a new Republican movement, maybe the time is the right for us to deal with the situation and reunify the southern territories?;;;;;;;;;;X;#TODO
EVT_900012_OPTIONA;Now is the Time to deal with them both while they are weakened!;;;;;;;;;;X;Подходящее время, чтобы расправиться с ними!
EVT_900012_OPTIONB;First push the foreigners out of China and then we can work out a deal with the Republicans!;;;;;;;;;;X;Мы сможем договориться с республиканцами!
EVT_900012_OPTIONC;We are in no shape for a reunification war yet.;;;;;;;;;;X;Мы не готовы начать войну
EVT_900013_NAME;New Imperial Dynasty from the north are pressing for a united China;;;;;;;;;;X;Новая имперская династия с севера настаивает на объединении Китая
EVT_900013_DESC;The Tian Dynasty have decided that they alone should rule China, but our differences are great, namely in the areas of government and views on people's liberties and many of our people do not wish to join them.;;;;;;;;;;X;Династия Тянь решила, что она сама должна управлять Китаем, но наши взгляды на управление и права граждан слишком различны, многие наши граждане не хотят присоединения.
EVT_900013_OPTIONA;We refuse - push for twin governments;;;;;;;;;;X;Мы отказываемся, предложить им двойное правительство
EVT_900013_OPTIONB;Agree to exist under their rule;;;;;;;;;;X;Принять их власть
EVT_900013_OPTIONC;Agree, but demand introduction of civil liberties;;;;;;;;;;X;Согласиться, но потребовать увлечения гражданских прав
EVT_900013_OPTIOND;Down with Imperialism!;;;;;;;;;;X;Сокрушить империализм!
EVT_900014_NAME;The Republicans have refused to accept the Mandate of Heaven!;;;;;;;;;;X;Республиканцы отказались принять небесный мандат!
EVT_900014_DESC;The Republicans have obviously been too influenced by the foreign powers, we must remove their stain and reunify all of China!;;;;;;;;;;X;Республиканцы, похоже, под влиянием иностранцев, мы должны уничтожить их и объединить Китай!
EVT_900014_OPTIONA;Enfore the Mandate!;;;;;;;;;;X;Война!
EVT_900014_OPTIONB;Leave them be, we are not ready yet.;;;;;;;;;;X;Не трогать их, мы не готовы
EVT_900015_NAME;Unity for China!;;;;;;;;;;X;Объединение Китая!
EVT_900015_DESC;The Republican government has accepted our push for the total unification of our countries. This is a great day for all of China!;;;;;;;;;;X;Республиканское правительство приняло наше предложение об объединении. Это великий день для всего Китая!
EVT_900015_OPTIONA;Bring them into the fold!;;;;;;;;;;X;Присоединить их к себе!
EVT_900016_NAME;Republican conditions;;;;;;;;;;X;Условия республиканцев
EVT_900016_DESC;The Republicans have accepted to follow us if we promise to introduce and maintain modern civil liberties into our Empire.;;;;;;;;;;X;Республиканцы приняли наши условия, при условии что мы внедрим и будем соблюдать современные гражданские свободы в Империи.
EVT_900016_OPTIONA;Accept;;;;;;;;;;X;#TODO
EVT_900016_OPTIONB;Fools, We have the Mandate!;;;;;;;;;;X;Дураки, небесный мандат принадлежит нам!
EVT_900017_NAME;The Legation Cities;;;;;;;;;;X;#TODO
EVT_900017_DESC;The Legation Cities were the richest coastal cities of China and now they are under foreign control. With the southern provinces in our hand we should try to regain those lose territories as well. There is, however, a problem since the Treaty ports, as they're called, contain significant foreign investments and capital, and it may be unwise to antagonize all the major world powers....;;;;;;;;;;X;#TODO
EVT_900017_OPTIONA;Demand a full unification;;;;;;;;;;X;Потребовать полного воссоединения
EVT_900017_OPTIONB;Try to establish control over their government;;;;;;;;;;X;Потребовать контроля над правительством
EVT_900017_OPTIONC;Just let them be;;;;;;;;;;X;Оставить их в покое
EVT_900018_NAME;Demands of the new Empire;;;;;;;;;;X;Требования новой империи
EVT_900018_DESC;An envoy of the Tian Dynasty approched us in Shanghai. They demanded full unification with the new Empire.;;;;;;;;;;X;Посол новой династии Тян прибыл в Шанхай. Он потребовал полного объединения с новой империей.
EVT_900018_OPTIONA;We can't resist...;;;;;;;;;;X;Мы не можем отказаться...
EVT_900018_OPTIONB;We must resist those fanatics!;;;;;;;;;;X;Мы должны сопротивляться этим фанатикам!
EVT_900019_NAME;Demands of the new Empire;;;;;;;;;;X;Требования новой империи
EVT_900019_DESC;An envoy of the Tian Dynasty approched us in Shanghai. They demanded that we should accept supervision of our government by a representative of the Emperor and show some loyalty towards the new Empire in the future.;;;;;;;;;;X;Посол новой династии Тян прибыл в Шанхай. Он потребовал, чтобы наше правительство было подконтрольно представителю императора и было лояльно империи в будущем.
EVT_900019_OPTIONA;It's the best we can get;;;;;;;;;;X;У нас нет выбора
EVT_900019_OPTIONB;Those fanatics can't be trusted!;;;;;;;;;;X;Этим фанатикам нельзя доверять!
EVT_900020_NAME;Legation Cities refuse!;;;;;;;;;;X;Содружество Независимых Городов отказывается!
EVT_900020_DESC;The leaders of the Legation Cities refused our rightful claims, however, because of their status as internationally-recognized Free Cities, direct millitary confrontation might bring us unwanted attentions. According to our spies there are reports that the local triad families were originally remnants of the Ming-loyalist and anti-Manchu movements, maybe we could convince them to join us.;;;;;;;;;;X;#TODO
EVT_900020_OPTIONA;Approach the Triad gangs!;;;;;;;;;;X;Договоримся с триадами!
EVT_900020_OPTIONB;To hell with the foreign devils, attack!;;;;;;;;;;X;Атаковать! К чёрту иностранных дьяволов!
EVT_900021_NAME;Criminal Activities!;;;;;;;;;;X;Преступная деятельность!
EVT_900021_DESC;In Recent weeks there has been increasing street violence and gang fights, it looks like that the Triad bosses are in some kind of power struggle among themselves.;;;;;;;;;;X;В последние недели наблюдается всплеск уличного насилия и боёв между бандами, похоже боссы триад начали борьбу за власть.
EVT_900021_OPTIONA;Guess it's buisness as usual.....;;;;;;;;;;X;Это бизнес, как обычно...
EVT_900022_NAME;Gangs in Legation Cities;;;;;;;;;;X;Банды в Содружестве Городов
EVT_900022_DESC;The Triad faction which remained true to their roots as a Han nationalist movement was able to unify the criminal underworld of the Legation Cities, their representatives arrived in the imperial capital to swear fealty to our young emperor. They are ready to start the revolt and join the Heavenly Empire!;;;;;;;;;;X;#TODO
EVT_900022_OPTIONA;Excellent, send our support!;;;;;;;;;;X;Отлично, послать помощь!
EVT_900023_NAME;Revolt!;;;;;;;;;;X;Восстание!
EVT_900023_DESC;A sudden revolt broke out in our main cities, criminal gangs and protesters sweeped the street demanding that the ruling authorities step down in favour of popular, local Chinese figureheads. It looks like the underworld Triad families are behind the revolt with the backing of the Tian empire, as Chinese Imperial forces are building up at our borders demanding us to accept their offer to restore order. It looks like submission is the only option...;;;;;;;;;;X;#TODO
EVT_900023_OPTIONA;How could this happen...;;;;;;;;;;X;Как это могло произойти!
EVT_900024_NAME;Legation Cities accept;;;;;;;;;;X;Содружество Независимых Городов согласно
EVT_900024_DESC;The leaders of the Legation Cities have accepted our demands and promised to be more loyal to the Empire in the future.;;;;;;;;;;X;Руководители Содружества приняли наши требования и обещают быть более лояльными к империи в будущем.
EVT_900024_OPTIONA;Good;;;;;;;;;;X;Хорошо
EVT_900025_NAME;Legation Cities accept;;;;;;;;;;X;Содружество Независимых Городов согласно
EVT_900025_DESC;The leaders of the Legation Cities accepted our demand and joined the Empire.;;;;;;;;;;X;Лидеры Содружества приняли наши требования о входе в состав империи
EVT_900025_OPTIONA;Perfect;;;;;;;;;;X;Замечательно
EVT_900026_NAME;Dealing with Yunnan;;;;;;;;;;X;Что делать Юньнанем?
EVT_900026_DESC;Now that most of the easten part of southern China has been reunified it is time to figure out what to do with the Yunnan Warlord.;;;;;;;;;;X;После возвращения юго-восточной части страны, пришло время разобраться с милитаристами Юньнаня.
EVT_900026_OPTIONA;Warlords respond to threats;;;;;;;;;;X;Варлорды отреагируют на угрозы
EVT_900026_OPTIONB;Bring him to the table;;;;;;;;;;X;Пригласить за стол переговоров
EVT_900026_OPTIONC;This is too dangerous;;;;;;;;;;X;#TODO
EVT_900027_NAME;Tian Empire have Threatened Us!;;;;;;;;;;X;Империя Тянь угрожает нам!
EVT_900027_DESC;With the reclaiming of the AOG lands the new Empire from the north has delusions of fully rebuilding Imperial China - and we are next!;;;;;;;;;;X;После получения земель бывшей ВВК, новая Империя с севера хочет объединить Китай - и мы следующие!
EVT_900027_OPTIONA;We must give in;;;;;;;;;;X;Мы сдаемся
EVT_900027_OPTIONB;Ignore them;;;;;;;;;;X;Оставить их в покое
EVT_900027_OPTIONC;They want war! War it is!;;;;;;;;;;X;Они хотят войны? Они ее получат!
EVT_900028_NAME;Tian Empire want to talk;;;;;;;;;;X;Империя Тянь предлагает сесть за стол переговоров
EVT_900028_DESC;With the reclaiming of the AOG lands the new Empire from the north has delusions of fully rebuilding Imperial China - and they want to talk...!;;;;;;;;;;X;После получения земель бывшей ВВК, новая Империя с севера хочет объединить Китай - и нам пришло предложение о переговорах!
EVT_900028_OPTIONA;Just give in;;;;;;;;;;X;Согласиться на воссоединение
EVT_900028_OPTIONB;Ignore the offer;;;;;;;;;;X;Игнорировать предложение
EVT_900028_OPTIONC;Make an offer;;;;;;;;;;X;Сделать встречное предложение
EVT_900029_NAME;The Warlord has given in;;;;;;;;;;X;Юньнань сдается
EVT_900029_DESC;The Warlord of Yunnan has given in to our claims and the Empire is another step closer to being complete.;;;;;;;;;;X;Милитаристы Юньнаня приняли наши требования. Империя стала на один шаг ближе к полному воссоединению.
EVT_900029_OPTIONA;Reunification of China can't be stopped!;;;;;;;;;;X;Воссоединение Китая не остановить!
EVT_900030_NAME;We still haven't heard anything from Yunnan...;;;;;;;;;;X;Мы до сих пор не получили ответа от Юньнаня...
EVT_900030_DESC;Our messangers reached Yunnan days ago and we still have not heard anything back... how should we proceed?;;;;;;;;;;X;Наши посланники уже давно в Юньнане, но никакх новостей от них пока нет. Как мы отреагируем?
EVT_900030_OPTIONA;One last chance - mobilize;;;;;;;;;;X;Мобилизовать войска
EVT_900030_OPTIONB;Attack them now!;;;;;;;;;;X;Аттаковать прямо сейчас!
EVT_900030_OPTIONC;Forget it;;;;;;;;;;X;Забудьте
EVT_900031_NAME;The Yunnan Offer;;;;;;;;;;X;Предложение Юньнаня
EVT_900031_DESC;The Yunnan have offered to pay homage to the Imperial Court and give us access and control over some parts of their government;;;;;;;;;;X;Воздавая должное Имперскому совету, Юньнань готов предложить нам участие в из правительстве.
EVT_900031_OPTIONA;Accept the offer;;;;;;;;;;X;Принять предложение
EVT_900031_OPTIONB;Full annexation or else;;;;;;;;;;X;Полное присоединение или война!
EVT_900031_OPTIONC;Let's stop wasting time - invade;;;;;;;;;;X;Давайте перестанем тратить время впустую, объявить войну!
EVT_900032_NAME;Tian Empire have mobilized troops;;;;;;;;;;X;Империя Тянь мобилизовала войска
EVT_900032_DESC;All along the border, the Tian Empire is readying troops and has repeated its demands - what should we do?;;;;;;;;;;X;По всей границе империя Тянь сосредотачивает войска. Ее правительство повторило требования, что мы будем делать?
EVT_900032_OPTIONA;We cannot win this war;;;;;;;;;;X;Согласиться с их требованиями
EVT_900032_OPTIONB;We must attack while we still can!;;;;;;;;;;X;Мы должны аттаковать, пока еще можем!
EVT_900001_NAME;Focus in international policy;;;;;;;;;;X;Цели внешней политики
EVT_900001_DESC;The southern territories were brought under our control after much effort, however there is no time to rest as the path to the reunification of China is still long, once again the Imperial Court should make the decision about the direction of our next step.;;;;;;;;;;X;#TODO
EVT_900001_OPTIONA;Go West!;;;;;;;;;;X;На запад!
EVT_900001_OPTIONB;Go North!;;;;;;;;;;X;На север!
EVT_900001_OPTIONC;What we achieved is enough;;;;;;;;;;X;Мы и так многого достигли
EVT_900002_NAME;Focus in international policy;;;;;;;;;;X;Цели внешней политики
EVT_900002_DESC;The western territories were brought under our control after much effort, however there is no time to rest as the path to the reunification of China is still long, once again the Imperial Court should make the decision about the direction of our next step.;;;;;;;;;;X;#TODO
EVT_900002_OPTIONA;Go South!;;;;;;;;;;X;На юг!
EVT_900002_OPTIONB;Go North!;;;;;;;;;;X;На север!
EVT_900002_OPTIONC;What we achieved is enough;;;;;;;;;;X;Мы и так многого достигли
EVT_66718_NAME;Focus in international policy;;;;;;;;;;X;Цели внешней политики
EVT_66718_DESC;The Northern territories were brought under our control after much effort, however there is no time to rest as the path to the reunification of China is still long, once again the Imperial Court should make the decision about the direction of our next step.;;;;;;;;;;X;#TODO
EVT_66718_OPTIONA;Go South!;;;;;;;;;;X;На юг!
EVT_66718_OPTIONB;Go West!;;;;;;;;;;X;На запад!
EVT_66718_OPTIONC;What we achieved is enough;;;;;;;;;;X;Мы и так многого достигли
EVT_66719_NAME;Focus in international policy;;;;;;;;;;X;Цели внешней политики
EVT_66719_DESC;The northern and southern territories were brought under our control after much effort, however there is no time to rest as the path to the reunification of China is still long, once again the Imperial Court should make the decision about the direction of our next step.;;;;;;;;;;X;#TODO
EVT_66719_OPTIONA;Go West!;;;;;;;;;;X;На запад!
EVT_66719_OPTIONB;What we achieved is enough;;;;;;;;;;X;Мы и так многого достигли
EVT_66720_NAME;Focus in international policy;;;;;;;;;;X;Цели внешней политики
EVT_66720_DESC;The western and southern territories were brought under our control after much effort, however there is no time to rest as the path to the reunification of China is still long, once again the imperial court should make the decision about the direction of our next step.;;;;;;;;;;X;#TODO
EVT_66720_OPTIONA;Go North!;;;;;;;;;;X;На север!
EVT_66720_OPTIONB;What we achieved is enough;;;;;;;;;;X;Мы и так многого достигли
EVT_66721_NAME;Focus in international policy;;;;;;;;;;X;Цели внешней политики
EVT_66721_DESC;The western and northern territories were brought under our control after much effort, however there is no time to rest as the path to the reunification of China is still long, once again the Imperial Court should make the decision about the direction of our next step.;;;;;;;;;;X;#TODO
EVT_66721_OPTIONA;Go South!;;;;;;;;;;X;На юг!
EVT_66721_OPTIONB;What we achieved is enough;;;;;;;;;;X;Мы и так многого достигли
EVT_900050_NAME;Move into Western regions against the Hui Warlords;;;;;;;;;;X;Экспансия в западные регионы
EVT_900050_DESC;Raiders and bandits have terrorized the western regions for decades now and the Hui warlords do not lift a finger against them. With central China under our control now it's the time to secure the western flank!;;;;;;;;;;X;Рейдеры и бандиты терроризируют западные территории годами, а местные милитаристы Хуэй ничего не могут сделать против них. Мы контролируем центральный Китай и пришло время обезопасить западный фланг!
EVT_900050_OPTIONA;The Northwestern warlords must submit, issue an ultimatum!;;;;;;;;;;X;Отправить ультиматум!
EVT_900050_OPTIONB;Heed the advice of the hawks, attack!;;;;;;;;;;X;Послушать ястребов, атаковать!
EVT_900050_OPTIONC;We have more important things to do...;;;;;;;;;;X;У нас есть дела поважнее...
EVT_900051_NAME;The Heavenly Dynasty claims the Northwest;;;;;;;;;;X;#TODO
EVT_900051_DESC;With the new Tian Empire gaining most of the former imperial realms - they are asking for us to come to the table to discuss the terms of our surrender;;;;;;;;;;X;#TODO
EVT_900051_OPTIONA;We must submit before the Empire;;;;;;;;;;X;#TODO
EVT_900051_OPTIONB;We shall fight for our freedom!;;;;;;;;;;X;#TODO
EVT_900051_OPTIONC;We shall rejoin the central Empire on our own terms...;;;;;;;;;;X;#TODO
EVT_900052_NAME;The Hui Resolve;;;;;;;;;;X;Северо-Западное Содружество воссоединяется с нами
EVT_900052_DESC;Our diplomatic pressure on the Ma clique of the Northwest has paid off. The Hui warlords have agreed to rejoin their domains with that of our new China. Long live the Heavenly Empire!;;;;;;;;;;X;#TODO
EVT_900052_OPTIONA;Western border finally secured!;;;;;;;;;;X;#TODO
EVT_900053_NAME;The Ma Warlords Demand Autonomy;;;;;;;;;;X;Северо-Западное Содружество требует автономию
EVT_900053_DESC;Our demands for the Northwest's submission have been all but rejected by Ma Fuxiang. However, the Hui despots in turn  offer us complete control over foreign relations whilst they maintain their iron grip over the western provinces.;;;;;;;;;;X;#TODO
EVT_900053_OPTIONA;They dare to make claims - crush these petty warlords!;;;;;;;;;;X;Они что-то требуют? Раздавить их!
EVT_900053_OPTIONB;They will be our tributary state in the West!;;;;;;;;;;X;#TODO
EVT_900054_NAME;Xibei Lianbang has been defeated! ;;;;;;;;;;X;#TODO
EVT_900054_DESC;We have conquered the western regions and defeated the Hui warlords! Those heathens shall bow before the might of Heaven;;;;;;;;;;X;#TODO
EVT_900054_OPTIONA;Di Guo Wan Sui!;;;;;;;;;;X;Да здравствует империя!
EVT_900055_NAME;Move into Western regions against Mongols;;;;;;;;;;X;#TODO
EVT_900055_DESC;The northwestern Hui warlords were defeated by the Mongols and now those lands are being controlled by those babarians, maybe now it's the time to convince them to return what is rightfully ours?;;;;;;;;;;X;#TODO
EVT_900055_OPTIONA;Send an envoy!;;;;;;;;;;X;#TODO
EVT_900055_OPTIONB;Crush the Babarians!;;;;;;;;;;X;#TODO
EVT_900055_OPTIONC;Its too risky;;;;;;;;;;X;#TODO
EVT_900056_NAME;Dealing with the Tian Empire;;;;;;;;;;X;#TODO
EVT_900056_DESC;With our destruction of the Xibei San Ma clique the Tian empire has decided to approach us with demands regarding the lands they claim. It would be wise to try to negotiate with them, since Mongolia is not strong enough to face the new rising power in China...;;;;;;;;;;X;#TODO
EVT_900056_OPTIONA;Agree to come to the table;;;;;;;;;;X;Согласиться на переговоры
EVT_900056_OPTIONB;Never!;;;;;;;;;;X;#TODO
EVT_900057_NAME;Negotiations with Mongolians;;;;;;;;;;X;#TODO
EVT_900057_DESC;The government of Mongolia has agreed to meet with us to discuss the terms regrading the disputed territory of the former Hui warlords, currently occupied by Mongolia. What should we ask for?;;;;;;;;;;X;#TODO
EVT_900057_OPTIONA;We want all of our lands!;;;;;;;;;;X;Мы хотим все наши земли!
EVT_900057_OPTIONB;Split the country;;;;;;;;;;X;Разделить земли
EVT_900058_NAME;Mongolia Refuses;;;;;;;;;;X;Штернберг отказывается
EVT_900058_DESC;Mongolia, through its representative, refused all our claims upon Chinese ancestral lands. What shall we do?;;;;;;;;;;X;#TODO
EVT_900058_OPTIONA;It's not worth the risk anyway;;;;;;;;;;X;#TODO
EVT_900058_OPTIONB;They will regret this!;;;;;;;;;;X;#TODO
EVT_900059_NAME;Tian Empire are asking for everything;;;;;;;;;;X;#TODO
EVT_900059_DESC;Tian Empire are asking our homeland to secede everything that is not Mongol land - evrything we fought so hard to gain. We should not give it up lightly!;;;;;;;;;;X;#TODO
EVT_900059_OPTIONA;They want it they will have to pay;;;;;;;;;;X;Никогда!
EVT_900059_OPTIONB;Outright refuse these absurd demands!;;;;;;;;;;X;#TODO
EVT_900059_OPTIONC;It nothing but a wasteland anyways;;;;;;;;;;X;#TODO
EVT_900060_NAME;We have recieved the Mongol offer;;;;;;;;;;X;Мы получили встречное положение от монголов
EVT_900060_DESC;Sternberg has responded and his costs are very high. Mongolia demand monetary as well as territorial compensation for the territories of the former Hui warlords. How shall we respond?;;;;;;;;;;X;#TODO
EVT_900060_OPTIONA;Accept the deal;;;;;;;;;;X;Принять предложение
EVT_900060_OPTIONB;We will take our lands by force then;;;;;;;;;;X;#TODO
EVT_900060_OPTIONC;This was worthless;;;;;;;;;;X;Эта земля не стоит денег
EVT_900061_NAME;They Accepted;;;;;;;;;;X;Цин согласна на сделку
EVT_900061_DESC;Tian empire have accepted our demands - we have gained control over ancestral Mongolian territory in return for the territories of the former Hui warlords!;;;;;;;;;;X;#TODO
EVT_900061_OPTIONA;Huzzah;;;;;;;;;;X;Ура
EVT_900062_NAME;Mongolia accepts our demands;;;;;;;;;;X;#TODO
EVT_900062_DESC;Seeing no other choice, Mongols accepted our demands and decided to cede the whole area of the former Xibei San Ma to us.;;;;;;;;;;X;#TODO
EVT_900062_OPTIONA;Di Guo Wan Sui!;;;;;;;;;;X;Да здравствует империя!
EVT_900064_NAME;Tian empire are asking for a split;;;;;;;;;;X;#TODO
EVT_900064_DESC;Tian empire are asking for a deal that would split the former Xibei lands. This would greatly increase our legitimacy over some of these lands.;;;;;;;;;;X;#TODO
EVT_900064_OPTIONA;Accept the deal;;;;;;;;;;X;Принять предложение
EVT_900064_OPTIONB;They are all our lands;;;;;;;;;;X;Это наши земли!
EVT_900065_NAME;Mongolians response;;;;;;;;;;X;#TODO
EVT_900065_DESC;Mongolia accepted our offer to split the territories of the former Hui warlords in return for recognition of the new borders as well as monetary compensation.;;;;;;;;;;X;#TODO
