#\China\AOG.txt;;;;;;;;;;;X;
EVT_627048_DESC;The increasingly pwoerfull Qing Empire have set their eyes upon us as our further existence show to the world weakness of the Qing dynasty and prevents their further expansion. Just a few days ago, they have issued an offer to us, in which they promise to offer pardon for the whole milenarian movement and promise to implement part of our reforms into the real life. How shall we respond to this proposal ?;;;;;;;;;;X;#TODO
EVT_627048_OPTIONA;Accept their offer;;;;;;;;;;X;#TODO
EVT_627048_OPTIONB;Never!;;;;;;;;;;X;#TODO
EVT_627048_OPTIONC;Demand Consessions!;;;;;;;;;;X;#TODO
EVT_627009_NAME;Shangqing rebels refused our demands;;;;;;;;;;X;#TODO
EVT_627009_DESC;Arrogant leadership of Shangqing rebels refused our reasonable demands and talks with them have broken down. Only war can bring this fools to accept our invevitable rule over China....;;;;;;;;;;X;#TODO
EVT_627009_OPTIONA;War will solve this !;;;;;;;;;;X;#TODO
EVT_627009_OPTIONB;We dare not to attack them...;;;;;;;;;;X;#TODO
EVT_627049_NAME;The Shangqing Surrender;;;;;;;;;;X;#TODO
EVT_627049_DESC;The Shangqing have realized the situation was hopeless and given up peacefully their futile resistance.;;;;;;;;;;X;#TODO
EVT_627049_OPTIONA;Another Step closer!;;;;;;;;;;X;#TODO
EVT_627055_NAME;Reworking our China policy;;;;;;;;;;X;#TODO
EVT_627055_DESC;With the Shangqing defeated and the Qing Empire in our alliance maybe we should rework our China policies, concerning the AoG, since maintaining this quasi-corporate state is costing a great amount of resources that we need to maintain our dominance in Europe.;;;;;;;;;;X;#TODO
EVT_627055_OPTIONA;The AoG should go back to the Qing;;;;;;;;;;X;#TODO
EVT_627055_OPTIONB;Maintain the status quo;;;;;;;;;;X;#TODO
EVT_628039_NAME;The Shangqing are Demanding Concessions;;;;;;;;;;X;#TODO
EVT_628039_DESC;The Shangqing broke away from us for many reasons, now they will only rejoin us if we give in to major part of their demands. They wish for us to cut all our obligations to the foreign devils, dismiss them from our government and to focus on rebuilding China.;;;;;;;;;;X;#TODO
EVT_628039_OPTIONA;It is best for China to have peace, we agree;;;;;;;;;;X;#TODO
EVT_628039_OPTIONB;This must come to an end, NOW!;;;;;;;;;;X;#TODO
EVT_627005_NAME;Restoration of the Qing Empire;;;;;;;;;;X;#TODO
EVT_627005_OPTIONA;Our Empire shall be restored !;;;;;;;;;;X;#TODO
EVT_627006_NAME;Restoration of the Qing Empire;;;;;;;;;;X;#TODO
EVT_627006_DESC;With reincorporation of the territory once held by Shangtiang rebels, the Qing Empire is on its way towards its full restoration. We must be wary since the Qing Empire will now turn towards other separatists pseudo states in China in hopes of reunitng entire country under single banner, which can endanger our interests in China, since unified and powerfull Empire will not provide such an easy target for our economical exploatation....;;;;;;;;;;X;#TODO
EVT_627006_OPTIONA;We need to be wary !;;;;;;;;;;X;#TODO
EVT_627007_NAME;Restoration of the Qing Empire;;;;;;;;;;X;#TODO
EVT_627007_DESC;With reincorporation of the territory once held by Shangtiang rebels, the Qing Empire is on its way towards its full restoration. We must be wary since the Qing Empire will now turn towards other separatists pseudo states in China in hopes of reunitng entire country under single banner, which can endanger our interests in China, since unified and powerfull Empire will not provide such an easy target for our economical exploatation....;;;;;;;;;;X;#TODO
EVT_627007_OPTIONA;We need to be wary !;;;;;;;;;;X;#TODO
EVT_627008_NAME;Restoration of the Qing Empire;;;;;;;;;;X;#TODO
EVT_627008_DESC;With reincorporation of the territory once held by Shangtiang rebels, the Qing Empire is on its way towards its full restoration. We must be wary since the Qing Empire will now turn towards other separatists pseudo states in China in hopes of reunitng entire country under single banner, which can endanger our interests in China, since unified and powerfull Empire will not provide such an easy target for our economical exploatation....;;;;;;;;;;X;#TODO
EVT_627008_OPTIONA;We need to be wary !;;;;;;;;;;X;#TODO
EVT_627019_NAME;Rebuilding the Empire;;;;;;;;;;X;Восстановление империи
EVT_627019_DESC;Our glorious emperor in his speech expressed his interest in reclaiming the lost areas of the Empire. The corporate AoG have almost complete control over half of our territory and it is time that we took necessary steps to reclaim it!;;;;;;;;;;X;В своем недавнем выступлении император заявил, что он вернет потерянные земли. Всеобщая восточноазиатская компания контролирует половину нашей территории, пришло время, чтобы вернуть земли!
EVT_627019_OPTIONA;We must find a way to reclaim our lands to the south;;;;;;;;;;X;Мы должны найти способ вернуть южные земли
EVT_627020_NAME;The Qing Demands Negotiations;;;;;;;;;;X;Цин пытается вернуть свои земли
EVT_627020_DESC;After seizing territory of the former Shangqing rebels, the Qing Empire has become much bolder in their stance towards us. Their diplomatic representative has brought us an official demand from the Qing Empire, in which he demand complete renegotiations of status of the southern China, which is legally the Qing territory but in reality due to stipulations of the 1926 treaty of Nanjing administered by us.;;;;;;;;;;X;#TODO
EVT_627020_OPTIONA;We refuse outright!;;;;;;;;;;X;Полный отказ!
EVT_627020_OPTIONB;We will enter the negotiations;;;;;;;;;;X;Начнем переговоры
EVT_627020_OPTIONC;We shall go without a fight;;;;;;;;;;X;Мы не будем сражаться
EVT_627022_NAME;AOG refused our demands !;;;;;;;;;;X;Они отказываются сесть за стол переговоров!
EVT_627022_DESC;The cursed AOG board of directors have refused to even come to the table to talk with us regarding status of the southern China. We must deal with this !;;;;;;;;;;X;Всеобщая восточноазиатская компания отказалась начать переговоры. Мы должны решить эту проблему!
EVT_627022_OPTIONA;Approach Germany and ask them to reign in their companies;;;;;;;;;;X;Обратиться к Германии, чтобы она разрешила спор
EVT_627022_OPTIONB;Threaten them with war!;;;;;;;;;;X;Угрожать им войной!
EVT_627022_OPTIONC;Back down and let them continue on;;;;;;;;;;X;Отступить и позволить продолжить им свою деятельность
EVT_627023_NAME;Let the negotiations begin;;;;;;;;;;X;Пусть начнутся переговоры
EVT_627023_DESC;The Board of the AoG, that controls the southern half of our country, has come to the table to renegotiate status of the territories which legally belong to our empire, but in reality they are administered from 1926 by AOG.;;;;;;;;;;X;#TODO
EVT_627023_OPTIONA;Press for full unity;;;;;;;;;;X;Настаивать на полном объединении
EVT_627023_OPTIONB;Offer them positions with our Government;;;;;;;;;;X;Предложить места в нашем правительстве
EVT_627024_NAME;Status of AOG;;;;;;;;;;X;Статус ВВК
EVT_627024_DESC;Once the AoG decided to fully rejoin the Qing Empire there were several options open on how to reassert control over territories once governed by AOG. We may either integrate these territories immediately, which may cause serious administration problems and potentially disrupt stability of the southern territories or inegrate them gradually...;;;;;;;;;;X;#TODO
EVT_627024_OPTIONA;Reclaim that which is rightfully ours!;;;;;;;;;;X;Полное воссоединение!
EVT_627024_OPTIONB;Let them keep their semi-independent style;;;;;;;;;;X;Сохранить автономию
EVT_627025_NAME;The Qing are asking for arbitration;;;;;;;;;;X;Цин просят разрешения спора
EVT_627025_DESC;The Qing are trying to reassert control over the Southern China, which is administered by the AoG from 1926 treaty of Nanjing - what course of action should we take at the table ?;;;;;;;;;;X;#TODO
EVT_627025_OPTIONA;We should force the AoG to give in - the legal precedent is clear;;;;;;;;;;X;Передать Всеобщую восточноазиатскую компанию им
EVT_627025_OPTIONB;The AoG is our company and we give them protection!;;;;;;;;;;X;Всеобщая восточноазиатская компания под нашей защитой!
EVT_627025_OPTIONC;Give them the company for exchange for a full alliance;;;;;;;;;;X;Передать земли ВВК в обмен на союз
EVT_627026_NAME;Qing Empire threatens us with war !;;;;;;;;;;X;Цин угрожает войной!
EVT_627026_DESC;We have been threatened by the Qing, due to our refusal to negotiate a deal with them. Is this truly worth a civil war or should we at least negotiate ?;;;;;;;;;;X;Цин угрожает войной, так как мы отказались вести переговоры. Стоит ли это войны или лучше провести переговоры?
EVT_627026_OPTIONA;This is not worth a war;;;;;;;;;;X;Это не стоит войны, согласиться на их предложение
EVT_627026_OPTIONB;Show the might of German arms and they will back down!;;;;;;;;;;X;Увидев мощь немецкого оружия они отступят!
EVT_627026_OPTIONC;Let's go to the table;;;;;;;;;;X;Сядем за стол переговоров
EVT_627026_OPTIOND;They dare to threaten us? Destroy them!;;;;;;;;;;X;Они нам угрожают? Уничтожим их!
EVT_627027_NAME;Let the negotiations begin;;;;;;;;;;X;Пусть начнутся переговоры
EVT_627027_DESC;The German companies of the AoG have come to the table after we threatened them with war. We should take a conciliatory stance to make the best of this.;;;;;;;;;;X;ВВК сели за стол переговоров, после того, как мы стали угрожать им войной. Мы должны занять примирительную позицию, чтобы достигнуть лучшего результата.
EVT_627027_OPTIONA;Press for full unity;;;;;;;;;;X;Настаивать на полном объединении
EVT_627027_OPTIONB;Offer positions with our Government;;;;;;;;;;X;Предложить места в новом правительстве
EVT_627028_NAME;The Qing offer;;;;;;;;;;X;Предложение Цин
EVT_627028_DESC;The Qing's offer is very one-sided and will mean the end of our control - they want us out.;;;;;;;;;;X;Предложение Цин не оставляет места для обсуждения, оно означает конец нашего существования.
EVT_627028_OPTIONA;Of course not!;;;;;;;;;;X;Конечно нет!
EVT_627028_OPTIONB;Accept their offer;;;;;;;;;;X;#TODO
EVT_627029_NAME;The Qing offer;;;;;;;;;;X;Предложение Цин
EVT_627029_DESC;The Qing have offered us a deal which might suit the both of us very well, they will regain direct control  over the Southern China, while our leader von Falkenhausen and the board of irectors will be given posts in the new Qing government. How shall we react to this offer ?;;;;;;;;;;X;#TODO
EVT_627029_OPTIONA;We accept;;;;;;;;;;X;Примем их предложение
EVT_627029_OPTIONB;Close but no deal;;;;;;;;;;X;Заманчиво, но этого не будет
EVT_627030_NAME;German protection of AOG;;;;;;;;;;X;#TODO
EVT_627030_DESC;The Germans have betrayed their agreements with us in favor of keeping their cursed company intact, out of our direct control and with it the entire Southern China ! What shall we do ?;;;;;;;;;;X;#TODO
EVT_627030_OPTIONA;Threaten the AoG with War!;;;;;;;;;;X;#TODO
EVT_627030_OPTIONB;War will solve this !;;;;;;;;;;X;#TODO
EVT_627030_OPTIONC;It is time to back down;;;;;;;;;;X;#TODO
EVT_627031_NAME;Negotiations have broken down;;;;;;;;;;X;#TODO
EVT_627031_DESC;Now that the negotiations with AOG board of directors have broken down we must decide what course to take in regard to the continuous existence of AOG and its presence on Chinese soil.;;;;;;;;;;X;#TODO
EVT_627031_OPTIONA;Threaten the AoG with War!;;;;;;;;;;X;#TODO
EVT_627031_OPTIONB;War will solve this !;;;;;;;;;;X;#TODO
EVT_627031_OPTIONC;Back down and let them continue on;;;;;;;;;;X;Отступить и позволить продолжить им свою деятельность
EVT_627032_NAME;The AoG are joining the Empire;;;;;;;;;;X;ВВК присоединяется к империи
EVT_627032_DESC;Germans has accepted our offer to fully incorporate territory administered by AOG into ur empire! The AoG is once again part of the Qing Empire !;;;;;;;;;;X;#TODO
EVT_627032_OPTIONA;This is a great day for China!;;;;;;;;;;X;Это великий день для Китая!
EVT_627021_NAME;The AoG offically join us!;;;;;;;;;;X;ВВК официально присоединяеться к нам!
EVT_627021_DESC;Since accepting our compromise offer allowing the AoG to continue - just under our watch, we have been working to implement them into our government and forces. That process is now complete!;;;;;;;;;;X;ВВК, приняв наше предложение, теперь работает совместно с нашим правительством.
EVT_627021_OPTIONA;Great !;;;;;;;;;;X;Ok
EVT_627044_NAME;The AoG threaten us with German Arms;;;;;;;;;;X;ВВК угрожает немецким военным вмешательством
EVT_627044_DESC;The AoG have threatened to use the Kaiser's forces against us. Rumour has it the Kaiser was not pleased. We could call their bluff;;;;;;;;;;X;ВВК угрожает использовать кайзеровские войска против нас. Ходят слухи, что кайзеру это не понравилось, так что, скорее всего, это блеф.
EVT_627044_OPTIONA;Call their bluff;;;;;;;;;;X;Это все блеф
EVT_627044_OPTIONB;Back down and let them continue on;;;;;;;;;;X;Отступить и позволить продолжить им свою деятельность
EVT_627045_NAME;The Qing have called our bluff;;;;;;;;;;X;Цин заявили, что мы блефуем
EVT_627045_DESC;We tried to bluff the Qing and they have called us on it...;;;;;;;;;;X;Мы хотели обмануть Цин, но они заявили, что мы блефуем. Что же нам теперь делать?
EVT_627045_OPTIONA;All right back to the table;;;;;;;;;;X;Вернемся за стол переговоров
EVT_627045_OPTIONB;Our own forces will do the job!;;;;;;;;;;X;Это война!
EVT_627035_NAME;Expansion of the Qing Empire;;;;;;;;;;X;#TODO
EVT_627035_DESC;The Qing have just reclaimed control over the AoG - and rumor has it that we might be the next to be brought into the fold... if we approach them with an offer first, maybe we can get a good deal?;;;;;;;;;;X;#TODO
EVT_627035_OPTIONA;Approach them before they come to us!;;;;;;;;;;X;#TODO
EVT_627035_OPTIONB;We have international protection, ignore them;;;;;;;;;;X;#TODO
EVT_627036_NAME;The Legation Cities;;;;;;;;;;X;#TODO
EVT_627036_DESC;The Legation Cities have approached us about rejoining the Empire, they think that by taking the initiative we will give them a good deal. The problem with these cities is that the Triads maintain quite a bit of power and cities itself are under international protection, so direct annexation can bring us a lot of troubles....;;;;;;;;;;X;#TODO
EVT_627036_OPTIONA;Incorporate them directly into Empire;;;;;;;;;;X;#TODO
EVT_627036_OPTIONB;Establish control over Leagtion cities;;;;;;;;;;X;#TODO
EVT_627036_OPTIONC;The ports are too dangerous;;;;;;;;;;X;#TODO
EVT_627037_NAME;Dealing with Yunnan;;;;;;;;;;X;Что делать Юньнанем?
EVT_627037_DESC;Now that the AoG and Shangqing rebels have been dealt with it is time to figure out what to do with the rogue warlords occupying Yunnan province.;;;;;;;;;;X;Теперь, когда ВВК нет и повстанцы Шанцин разбиты, пришло время подумать о том, что делать с Юньнанем.
EVT_627037_OPTIONA;Warlords respond to threats;;;;;;;;;;X;Варлорды отреагируют на угрозы
EVT_627037_OPTIONB;Bring them to the table;;;;;;;;;;X;#TODO
EVT_627037_OPTIONC;This is too dangerous;;;;;;;;;;X;#TODO
EVT_627038_NAME;The Qing Have Threatened Us!;;;;;;;;;;X;Цин угрожают нам!
EVT_627038_DESC;With the reclaiming of the AoG lands the Qing have delusions of fulling rebuilding their Empire - and we are next! They have already issued us an ulimatum demanding our immediate surrender.;;;;;;;;;;X;Получив земли ВВК, Цин хочет восстановить империю, мы следующие на этом пути!
EVT_627038_OPTIONA;We give in;;;;;;;;;;X;Мы согласны
EVT_627038_OPTIONB;Ignore the Qing;;;;;;;;;;X;Игнорировать Цин
EVT_627038_OPTIONC;They want war! War it is!;;;;;;;;;;X;Они хотят войны? Они ее получат!
EVT_627039_NAME;The Qing want to talk;;;;;;;;;;X;Цин предлагает переговоры
EVT_627039_DESC;With the reclaiming of the AoG lands the Qing have delusions of fulling rebuilding their Empire - and they want to talk regarding our status in the Qing Empire. They are offering our leadership amnesty and positions in the managent of province should we lay down our weapons and accept central government in Beijing.;;;;;;;;;;X;#TODO
EVT_627039_OPTIONA;Just give in;;;;;;;;;;X;Согласиться на воссоединение
EVT_627039_OPTIONB;Ignore the offer;;;;;;;;;;X;Игнорировать предложение
EVT_627039_OPTIONC;Make an offer;;;;;;;;;;X;Сделать встречное предложение
EVT_627040_NAME;The warlord has given in;;;;;;;;;;X;Юньнань сдается
EVT_627040_DESC;The Warlord of Yunnan has given in to our claims and the Empire is another step closer to being complete;;;;;;;;;;X;Лун Юнь согласился с нашими требованиями. Это шаг на пути к восстановлению империи!
EVT_627040_OPTIONA;Yunnan is part of the Empire once again!;;;;;;;;;;X;Да здравствует Китай!
EVT_627041_NAME;We still haven't heard anything from Yunnan...;;;;;;;;;;X;Мы до сих пор не получили ответа от Юньнаня...
EVT_627041_DESC;Our messangers reached Yunnan days ago and we still have not heard anything back... how should we proceed?;;;;;;;;;;X;Наши посланники уже давно в Юньнане, но никакх новостей от них пока нет. Как мы отреагируем?
EVT_627041_OPTIONA;One last chance - mobilize;;;;;;;;;;X;Мобилизовать войска
EVT_627041_OPTIONB;Attack them now!;;;;;;;;;;X;Аттаковать прямо сейчас!
EVT_627041_OPTIONC;Forget it;;;;;;;;;;X;Забудьте
EVT_627042_NAME;The Yunnan Offer;;;;;;;;;;X;Предложение Юньнаня
EVT_627042_DESC;The Yunnan have offered to pay homage to Pu Yi and give us access and control over some parts of their government;;;;;;;;;;X;Юньнань предложили воздать должное Пу И, предоставив нам контроль над частью их правительства.
EVT_627042_OPTIONA;Accept the offer;;;;;;;;;;X;Принять предложение
EVT_627042_OPTIONB;Full annexation or else;;;;;;;;;;X;Полное присоединение или война!
EVT_627042_OPTIONC;Let's stop wasting time - invade;;;;;;;;;;X;Давайте перестанем тратить время впустую, объявить войну!
EVT_627043_NAME;The Qing have mobilized troops;;;;;;;;;;X;Цин мобилизует войска
EVT_627043_DESC;All along the border the Qing are readying troops and have repeated their demands - what should we do ?;;;;;;;;;;X;#TODO
EVT_627043_OPTIONA;We cannot win this war;;;;;;;;;;X;Согласиться с их требованиями
EVT_627043_OPTIONB;We must attack while we still can!;;;;;;;;;;X;Мы должны аттаковать, пока еще можем!
EVT_628048_NAME;The AoG is no more;;;;;;;;;;X;ВВК больше нет
EVT_628048_DESC;Through negotiations with the Qing Empire we have lost much of our say, and capital in China. With our economy still recovering from the crash we must now deal with this loss.;;;;;;;;;;X;#TODO
EVT_628048_OPTIONA;There is nothing we can do;;;;;;;;;;X;Мы ничего не можем сделать
EVT_628048_OPTIONB;We must invest elsewhere to compensate;;;;;;;;;;X;Мы должны инвестировать в другие места, чтобы компенсировать утрату
EVT_628048_OPTIONC;We must push the Qing for favorable trading conditions;;;;;;;;;;X;Мы должны подтолкнуть Цин на благоприятные условия торговли
EVT_628049_NAME;The German Embassy is calling for a new trade agreement;;;;;;;;;;X;Германия предлагает новые торговые соглашения
EVT_628049_DESC;Since our reclamation of the south the German economy has been hurt. They wish to make a very one-sided agreement with us to make up for these losses!;;;;;;;;;;X;После аннексией нами ВВК, немцы потеряли свою экономическую власть над Китаем. Они хотят заключить односторонний договор, чтобы компенсировать свою утрату. Как мы отреагируем?
EVT_628049_OPTIONA;Agree;;;;;;;;;;X;Согласиться
EVT_628049_OPTIONB;Refuse!;;;;;;;;;;X;Отказаться!
EVT_628050_NAME;The Qing have refused our demand;;;;;;;;;;X;Цин отказалась принять наши требования
EVT_628050_DESC;The Qing have refused to accept our trade demands - how should we proceed ?;;;;;;;;;;X;#TODO
EVT_628050_OPTIONA;Let it go;;;;;;;;;;X;Забудем это
EVT_628050_OPTIONB;Impose sanctions;;;;;;;;;;X;Наложить на них санкции!
EVT_628051_NAME;The Germans are imposing economic sanctions on us!;;;;;;;;;;X;Немцы наложили на нас экономические санкции
EVT_628051_DESC;With our refusal to agree with their trade proposals, the German government has imposed sactions on us.;;;;;;;;;;X;После нашего отказа принять их торговое соглашение, Германия наложила на нас экономические санкции.
EVT_628051_OPTIONA;This hurts;;;;;;;;;;X;Это плохо
EVT_628051_OPTIONB;Accept all german demands;;;;;;;;;;X;#TODO
EVT_628051_OPTIONC;Find other markets for our goods;;;;;;;;;;X;Найти другие рынки сбыта наших товаров
EVT_628051_OPTIOND;They will pay for this in territory!;;;;;;;;;;X;Они заплатят за это территориями!
EVT_628052_NAME;The Qing are moving troops into our ports!;;;;;;;;;;X;Цин отправили войска в наши порты!
EVT_628052_DESC;Last night, in reaction to our economic sanctions, the Qing Empire moved troops across the border into our cities along the coast! They are claiming ownership and demanding that we back down before they invade Indochina!;;;;;;;;;;X;Вчера вечером, после наших экономических санкций, Цин отправила войска в наши колонии в Китае! Они требуют их передачи, пока они не вторглись в Индокитай!
EVT_628052_OPTIONA;We cannot afford a war halfway around the world;;;;;;;;;;X;Мы не можем позволить себе войну так далеко
EVT_628052_OPTIONB;The Kaiser will not stand for this INSULT!;;;;;;;;;;X;Это оскорбление лично кайзера! Война!
EVT_628072_NAME;Dealing with Xibei San Ma;;;;;;;;;;X;Договор с Северо-западным Содружеством
EVT_628072_DESC;With our rebuilding of the Empire we have accomplished a lot. Now it is time to bring the rebellious Xibei San Ma back into the fold.;;;;;;;;;;X;Возрождение империи практически завершено. Теперь пришло время вернуть территории Северо-западного Содружества.
EVT_628072_OPTIONA;They will respond to threats;;;;;;;;;;X;#TODO
EVT_628072_OPTIONB;Bring them to the table;;;;;;;;;;X;#TODO
EVT_628072_OPTIONC;This is too dangerous;;;;;;;;;;X;#TODO
EVT_628073_NAME;The Qing have issued an Ultimatium;;;;;;;;;;X;Цин предъявила ультиматум
EVT_628073_DESC;With the end of the Shangqing the Qing are now looking toward our lands - they have issued an ultimatium - surrender or die.;;;;;;;;;;X;Цин покончила с Шанцин, теперь ее взгляд обратился в нашу сторону. Она предъявила ультиматум - или мы воссоединимся с ней или погибнем.
EVT_628073_OPTIONA;Just give in;;;;;;;;;;X;Согласиться на воссоединение
EVT_628073_OPTIONB;Never!;;;;;;;;;;X;#TODO
EVT_628055_NAME;The Qing want to talk;;;;;;;;;;X;Цин предлагает переговоры
