#\China\AOG.txt;;;;;;;;;;;X;
EVT_630151_OPTIONB;We shall maintain our independent republic, even if it means fighting both these serpents!;;;;;;;;;;X;У нас будет своя, независимая республика. И если надо, мы будем сражаться! 
EVT_630152_NAME;The Fengtien Cave In;;;;;;;;;;X;Фэнтяньская Республика проводит референдум
EVT_630152_DESC;Thanks to subtle pressure from the Japanese government, Zhang Zuolin has opened his borders to our officials and international observers. Hopefully the referendum will proceed without any interference.;;;;;;;;;;X;Благодаря давлению со стороны Японии, Чжан Цзолинь открыл границы для наших чиновников и международных наблюдателей. Надеемся, что референдум даст нам хорошие результаты.
EVT_630152_OPTIONA;We await the results eagerly!;;;;;;;;;;X;Будем ждать результатов!
EVT_630152_OPTIONB;There's no need to vote, because we do not need Manchuria!;;;;;;;;;;X;Нам не нужно голосование, так как нам не нужна Маньчжурия!
EVT_630153_NAME;Results of the Manchurian Referendum;;;;;;;;;;X;Результаты Референдума
EVT_630153_DESC;The votes are ticking in from all four corners of our beleagured Republic, by now it seems clear that those supporting union with the Chinese Republic will score a major victory, yet with a few bags of cash and some gruff behaviour the possibilities are many.;;;;;;;;;;X;#TODO
EVT_630153_OPTIONA;The Unionist side scores a landslide victory, long live the United Republic!;;;;;;;;;;X;Да здравствует единая республика!
EVT_630153_OPTIONB;With manipulation and scare tacticts the proposal for unification is rejected!;;;;;;;;;;X;С помощью фальсификаций сторонники объединения проигрывают
EVT_630154_NAME;Manchuria Declares for the Republic;;;;;;;;;;X;Маньчжурия объединяется с Республикой
EVT_630154_DESC;Our man in Mukden has just contacted the foreign ministry - the people of Manchuria has overwhemlingly declared their support for our government. Once more, the far-reaching swathes of Manchuria will belong to China!;;;;;;;;;;X;Наши представители в Мукдене сообщают, что Маньчжурия согласна на объединение.
EVT_630154_OPTIONA;Glorious is our bloodless victory!;;;;;;;;;;X;Славная и бескровная победа!
EVT_630141_NAME;China Demands Manchuria's Submission;;;;;;;;;;X;Китай требует Маньчжурию подчиниться
EVT_630141_DESC;The national media is ablaze with the latest rumours form the south. Apparently, Republican officials have stated that Manchuria will have to join the the growing Chinese Republic, or face dire consequences...;;;;;;;;;;X;Республиканские власти заявили, что Маньчжурия должна присоединиться к Республике, иначе её ждут страшные последствия... 
EVT_630141_OPTIONA;We shall unite China under our banner, to war!;;;;;;;;;;X;Мы объединим Китай под нашим флагом, объявить войну!
EVT_630141_OPTIONB;Appeal to Japan for assistance!;;;;;;;;;;X;Попросить помощи у Японии!
EVT_630155_NAME;Fraud and Treachery at the Elections!;;;;;;;;;;X;Фальсификации на выборах!
EVT_630155_DESC;In a surprising turn of events, Zhang Zuolin and his clique of warlords have interfered in the referendum and coerced the populace into rejecting our proposal for unification! Tokyo has withdrawn her advsiors from Mukden, leaving the way open for the NRA to liberate the oppressed of Manchuria. China shall triumph!;;;;;;;;;;X;#TODO
EVT_630155_OPTIONA;Now is the time to wash the shame of 1895 off in Hanjian blood!;;;;;;;;;;X;Пришло время смыть позора 1895 года!
EVT_630155_OPTIONB;Back down, Manchuria is a lousy place anyways...;;;;;;;;;;X;Отступить, Маньчжурия гиблое место...
EVT_630142_NAME;Japan Stands By Zhang Zuolin!;;;;;;;;;;X;Япония защищает Чжан Цзолиня!
EVT_630142_DESC;Our ambassador in Tokyo has recieved a pretty blunt rebuttal from his Japanese contact regarding our ambitions on Manchuria. The Japanese government will defend her puppet through the force of arms in order to keep her foot on Chinese soil. Such imperialistic conduct must be humbled!;;;;;;;;;;X;#TODO
EVT_630142_OPTIONA;We shall bury them!;;;;;;;;;;X;Мы уничтожим их!
EVT_630142_OPTIONB;Back down, Manchuria is a lousy place anyways...;;;;;;;;;;X;Отступить, Маньчжурия гиблое место...
EVT_630156_NAME;The Manchurian Plebiscite;;;;;;;;;;X;Маньчжурский вопрос
EVT_630156_DESC;Following the establishment of Republican hegemony over much of Inner China, the National Assembly has instigated a formal debate on the status of the so-called Fengtien Republic. So far we have been very clear regarding our stance towards warlordism, but the Manchurian junta has the support of the Japanese Empire. Our position is dangerous and the cabinet is expected to conclude upon a course within hours. Some propose a peaceful referendum, others prefer sending in the NRA.;;;;;;;;;;X;#TODO
EVT_630156_OPTIONA;Issue a call for Manchurian self-determination!;;;;;;;;;;X;Призвать маньчжурцев провести референдум!
EVT_630156_OPTIONB;We speak softly and carry a bick stick, deploy the NRA!;;;;;;;;;;X;Развернуть НРА!
EVT_630156_OPTIONC;Try to shut the assembly up...;;;;;;;;;;X;Прекратить дебаты по этому вопросу...
EVT_630157_NAME;The Manchurian Plebiscite;;;;;;;;;;X;Маньчжурский вопрос
EVT_630157_DESC;Events are unfolding at an alarming pace on the Chinese mainland. The government of the Republic of China has announced its desire for a popular referendum to be held in order to decide whether or not the Fengtien Republic should rejoin China proper. The Republican demands are outrageous, but given their recent successes we might have to think twice before rejecting them.;;;;;;;;;;X;#TODO
EVT_630157_OPTIONA;Put pressure on Zhang Zuolin to comply with Republican demands!;;;;;;;;;;X;Заставить Чжан Цзолиня согласиться с требованиями Китайской Респубики
EVT_630157_OPTIONB;The interests of the empire lie with the Fengtien!;;;;;;;;;;X;Фэнтяньская Республика нужна империи!
EVT_630158_NAME;Japan Supports the Second Republic;;;;;;;;;;X;Япония поддерживает Вторую Республику
EVT_630158_DESC;Tokyo has released a statement supporting the Chinese Republicans in their bid to arrange a referendum about our continued existence outside the Chinese Republic. We are pressured on two fronts with the National Revolutionary Army posed to strike from Beijing whilst Japan's government withholds all support for our armies.;;;;;;;;;;X;#TODO
EVT_630158_OPTIONA;We yield because we have no choice, allow the plebiscite!;;;;;;;;;;X;У нас нет выбора, проведём референдум!
EVT_630158_OPTIONB;We shall maintain our independent republic, even if it means fighting both these serpents!;;;;;;;;;;X;У нас будет своя, независимая республика. И если надо, мы будем сражаться! 
EVT_630159_NAME;The Fengtien Cave In;;;;;;;;;;X;Фэнтяньская Республика проводит референдум
EVT_630159_DESC;Thanks to subtle pressure from the Japanese government, Zhang Zuolin has opened his borders to our officials and international observers. Hopefully the referendum will proceed without any interference.;;;;;;;;;;X;Благодаря давлению со стороны Японии, Чжан Цзолинь открыл границы для наших чиновников и международных наблюдателей. Надеемся, что референдум даст нам хорошие результаты.
EVT_630159_OPTIONA;We await the results eagerly!;;;;;;;;;;X;Будем ждать результатов!
EVT_630159_OPTIONB;There's no need to vote, because we do not need Manchuria!;;;;;;;;;;X;Нам не нужно голосование, так как нам не нужна Маньчжурия!
EVT_630160_NAME;Results of the Manchurian Referendum;;;;;;;;;;X;Результаты Референдума
EVT_630160_DESC;The votes are ticking in from all four corners of our beleagured Republic, by now it seems clear that those supporting union with the Chinese Republic will score a major victory, yet with a few bags of cash and some gruff behaviour the possibilities are many.;;;;;;;;;;X;#TODO
EVT_630160_OPTIONA;The Unionist side scores a landslide victory, long live the United Republic!;;;;;;;;;;X;Да здравствует единая республика!
EVT_630160_OPTIONB;With manipulation and scare tactics the proposal for unification is rejected!;;;;;;;;;;X;#TODO
EVT_630161_NAME;Manchuria Declares for the Republic;;;;;;;;;;X;Маньчжурия объединяется с Республикой
EVT_630161_DESC;Our man in Mukden has just contacted the foreign ministry - the people of Manchuria have overwhemlingly declared their support for our government. Once more, the far-reaching swathes of Manchuria will belong to China!;;;;;;;;;;X;Наши представители в Мукдене сообщают, что Маньчжурия согласна на объединение.
EVT_630161_OPTIONA;Glorious is our bloodless victory!;;;;;;;;;;X;Славная и бескровная победа!
EVT_630162_NAME;China Demands Manchuria's Submission;;;;;;;;;;X;Китай требует Маньчжурию подчиниться
EVT_630162_DESC;The national media is ablaze with the latest rumours form the south. Apparently, Republican officials have stated that Manchuria will have to join the the growing Chinese Republic, or face dire consequences...;;;;;;;;;;X;Республиканские власти заявили, что Маньчжурия должна присоединиться к Республике, иначе её ждут страшные последствия... 
EVT_630162_OPTIONA;We shall unite China under our banner, to war!;;;;;;;;;;X;Мы объединим Китай под нашим флагом, объявить войну!
EVT_630162_OPTIONB;Appeal to Japan for assistance!;;;;;;;;;;X;Попросить помощи у Японии!
EVT_630163_NAME;Fraud and Treachery at the Elections!;;;;;;;;;;X;Фальсификации на выборах!
EVT_630163_DESC;In a surprising turn of events, Zhang Zuolin and his clique of warlords have interfered in the referendum and coerced the populace into rejecting our proposal for unification! Tokyo has withdrawn her advsiors from Mukden, leaving the way open for the NRA to liberate the oppressed of Manchuria. China shall triumph!;;;;;;;;;;X;#TODO
EVT_630163_OPTIONA;Now is the time to wash the shame of 1895 off in Hanjian blood!;;;;;;;;;;X;Пришло время смыть позора 1895 года!
EVT_630163_OPTIONB;Back down, Manchuria is a lousy place anyways...;;;;;;;;;;X;Отступить, Маньчжурия гиблое место...
EVT_630164_NAME;Japan Stands By Zhang Zuolin!;;;;;;;;;;X;Япония защищает Чжан Цзолиня!
EVT_630164_DESC;Our ambassador in Tokyo has recieved a pretty blunt rebuttal from his Japanese contact regarding our ambitions on Manchuria. The Japanese government will defend her puppet through the force of arms in order to keep her foot on Chinese soil. Such imperialistic conduct must be humbled!;;;;;;;;;;X;#TODO
EVT_630164_OPTIONA;We shall bury them!;;;;;;;;;;X;Мы уничтожим их!
EVT_630164_OPTIONB;Back down, Manchuria is a lousy place anyways...;;;;;;;;;;X;Отступить, Маньчжурия гиблое место...
EVT_630205_NAME;Manchuria Votes for Unification With China;;;;;;;;;;X;#TODO
EVT_630205_DESC;The Fengtien clique who has governed Manchuria on our behalf has been strong-armed into accepting a popular referendum stipulating Manchuria's return to Chinese control. How should we react?;;;;;;;;;;X;#TODO
EVT_630205_OPTIONA;We have no choice but to comply.;;;;;;;;;;X;#TODO
EVT_630205_OPTIONB;What were we thinking?! We need Manchuria! To WAR!;;;;;;;;;;X;#TODO
EVT_630165_NAME;The Port Arthur Declaration;;;;;;;;;;X;Порт-Артурская Декларация
EVT_630165_DESC;After the utter defeat of the Imperial Japanese Army, our republican army controls huges swathes of land in Manchuria and Korea whilst the IJN is reduced to attempting mere blockades. Our man in Tokyo reports severe dissent and war weariness amongst the populace. In light of this, the government has called a conference in occupied Port Arthur to determine our war aims.;;;;;;;;;;X;#TODO
EVT_630165_OPTIONA;Manchuria and Taiwan to China and liberty for Korea!;;;;;;;;;;X;Маньчжурия и Тайвань Китаю и свобода Кореи!
EVT_630165_OPTIONB;We will fight 'till our flag flies over Tokyo!;;;;;;;;;;X;Мы будем сражаться до тех пор, пока наш флаг не будет развиваться над Токио!
EVT_630166_NAME;The Fading Sun over Port Arthur;;;;;;;;;;X;Заход солнца над Порт-Артуром
EVT_630166_DESC;This is a dark day for the Empire of the Sun. Chinese forces have ousted our men from their vital bases in Manchuria and Korea. On top of this, a declaration has been sent out from Port Arthur by the republican government offering terms that demand our surrender of all territories on the Chinese mainland as well as the return of Taiwan and the independence of Korea.;;;;;;;;;;X;#TODO
EVT_630166_OPTIONA;We yield because we have no other choice...;;;;;;;;;;X;Мы согласны, у нас нет другого выбора...
EVT_630166_OPTIONB;They must be joking, banzai!;;;;;;;;;;X;Они должно быть шутят, банзай!
EVT_630167_NAME;Japan Surrenders;;;;;;;;;;X;Япония капитулирует
EVT_630167_DESC;Ha zha! The Japanese government in Tokyo has bowed to our demands of the Port Arthur delcaration. The IJN has already begun evacuating the remnants of the Imperial army to the Home Isles, whilst wild celebration meets our troops from Seoul to Taipei. This treaty makes China one of the great powers and will forever wash away the shame of the cursed 19th century!;;;;;;;;;;X;#TODO
EVT_630167_OPTIONA;Finally, peace will blossom in the Far East!;;;;;;;;;;X;Наконец мир установится на Дальнем Востоке!
EVT_630168_NAME;Transamur is alone;;;;;;;;;;X;Заамурье осталось одно
EVT_630168_DESC;After the Qing pushed the Japanese back to their home islands, Transamur has been in chaos. The Japanese elite have fled back to their home and the country is in chaos. The people are ready to depose of Kolchak and return to the Motherland's control.;;;;;;;;;;X;После изгнания японцев с материка, Заамурская Республика погрузилась в хаос. Японская элита бежала домой. Люди готовы свергнуть Колчака и присоединиться к родине.
EVT_630168_OPTIONA;Move in and bring Transamur back under our control;;;;;;;;;;X;Взять контроль над Заамурской Республикой
EVT_630169_NAME;Reaching for the Himalayas;;;;;;;;;;X;Гималайский вопрос
EVT_630169_DESC;Although China proper has finally been united under the central authority of the Republican government much of the former Qing territories lie beyond our control. The flag of the Republic represents the five races of Zhonghua minzu, the Chinese nation, and although the Han red and Manchu blue stripes are under our rule, our claim to legitimacy might be compromised if we do not regain the other Chinese races. With the north secured, we might have a chance at subduing the Tibetans.;;;;;;;;;;X;#TODO
EVT_630169_OPTIONA;China will seize Tibet by force!;;;;;;;;;;X;Китай возьмёт Тибет силой!
EVT_630169_OPTIONB;Try to reason with these yak herders...;;;;;;;;;;X;Попробовать договориться с этими пастухами...
EVT_630170_NAME;The Dalai Lama's Decision;;;;;;;;;;X;Решение далай-ламы
EVT_630170_DESC;The resurgent republic of China has demanded our utter submission to the Chinese National Assembly. However, our government is divided regarding our answer to such boasts...;;;;;;;;;;X;Китайская Республика потребовала полного воссоединения с ними. Как мы отреагируем?
EVT_630170_OPTIONA;China's prosperity will be Tibet's great leap into modernity!;;;;;;;;;;X;Развивающийся Китай поможет развиться Тибету!
EVT_630170_OPTIONB;We accept, under the terms of wide autonomy!;;;;;;;;;;X;Мы согласны, но если нам предоставят широкую автономию! 
EVT_630170_OPTIONC;We shall fight these damned Han in defence of our freedom and culture!;;;;;;;;;;X;Мы должны бороться с проклятыми ханьцами, чтобы защитить нашу страну и культуру! 
EVT_630172_NAME;Tibet Caves In!;;;;;;;;;;X;Тибет наш!
EVT_630172_DESC;Today, the Tibetan government in Lhasa subcumbed to our pressure and has petitioned to be accepted into the Chinese Republic. Without having fired a single shot, we have inched a little closer to a complete unification of the old Imperial realm.;;;;;;;;;;X;Правительство Тибета согласилось присоединиться к нам. Мы не сделали ни единого выстрела. Китайская Республика стала на шаг ближе к полному объединению бывших цинских территорий.
EVT_630172_OPTIONA;Glory to the Five Races!;;;;;;;;;;X;Слава пяти расам!
EVT_630173_NAME;The Dalai Lama Demands Autonomy;;;;;;;;;;X;Далай-лама требует автономию
EVT_630173_DESC;We have recieved a letter from Lhasa which doesn't completely reject the union between the Republic and the Tibetan nation. However, the head of the Yellow Hats Buddhists has insisted on retaining his authority in local matters. Accepting this compromise will lead the way for peace, yet the hawks of the administration are calling for war to be declared on the break-away Tibetan state.;;;;;;;;;;X;#TODO
EVT_630173_OPTIONA;This compromise shall secure our frontier!;;;;;;;;;;X;Этот компромисс укрепит наши границы!
EVT_630173_OPTIONB;China is one and indivisible!;;;;;;;;;;X;Китай один и неделим!
EVT_630174_NAME;The Fate of the Ma Clique;;;;;;;;;;X;Судьба Северо-Западного Содружества
EVT_630174_DESC;Our eastern border has been thrown into chaos! Raiders and bandits are capitalizing on the liquid status of our relations with the Hui warlords of Xinjiang. Our citizens are terrorized by thugs and the Mas do not lift a finger against them! We must act for the integrity of the republic is at stake!;;;;;;;;;;X;#TODO
EVT_630174_OPTIONA;The Northwestern warlords must submit, issue an ultimatum!;;;;;;;;;;X;Отправить ультиматум!
EVT_630174_OPTIONB;Heed the advice of the hawks, attack!;;;;;;;;;;X;Послушать ястребов, атаковать!
EVT_630174_OPTIONC;We have more important things to do...;;;;;;;;;;X;У нас есть дела поважнее...
EVT_630175_NAME;The Republic Claims the Northwest;;;;;;;;;;X;Республика претендует на нашу территорию
EVT_630175_DESC;With the Chinese Republic regrown to most of its former glory - they are asking for us to come to the table to discuss the terms of our surrender.;;;;;;;;;;X;Республика вернула большинство бывших цинских территорий, они предложили сесть за стол переговоров, чтобы обсудить условия объединения.
EVT_630175_OPTIONA;The NRA is unstoppable, capitulate the Hui domains;;;;;;;;;;X;НРА уже не остановить, капитулировать
EVT_630175_OPTIONB;Who do they think they are!? We shall fight for our freedom!;;;;;;;;;;X;О чём они думают? Мы будем сражаться за нашу свободу!
EVT_630175_OPTIONC;We shall rejoin the Zhonghua minzu on our own terms...;;;;;;;;;;X;Мы вернёмся в состав Китая на наших условиях...
EVT_630176_NAME;The Hui Resolve;;;;;;;;;;X;Северо-Западное Содружество воссоединяется с нами
EVT_630176_DESC;Our diplomatic pressure on the Ma clique of the Northwest has payed off. The Hui warlords have agreed to rejoin their domains with that of the soaring Chinese republic. Long live the Five Races united under one republic!;;;;;;;;;;X;Наше давление на Содружество дало свои плоды. Они согласны воссоединится с нами. Да здравствуют пять рас в одной республике!
EVT_630176_OPTIONA;From Urumqi to Nanjing, China celebrates!;;;;;;;;;;X;От Урумчи до Нанкина народ празднует!
EVT_630177_NAME;The Ma Warlords Demand Autonomy;;;;;;;;;;X;Северо-Западное Содружество требует автономию
EVT_630177_DESC;Our demands for the Northwest's submission have been all but rejected by Ma Fuxiang, primus inter pares of the Ma Clique. However, the Hui despots in turn offer us complete control over foreign relations whilst they maintain their iron grip over the provinces between Shaanxi and Xinjiang.;;;;;;;;;;X;#TODO
EVT_630177_OPTIONA;They dare to make claims - crush these petty warlords!;;;;;;;;;;X;Они что-то требуют? Раздавить их!
EVT_630177_OPTIONB;They will be our shield against the West!;;;;;;;;;;X;Они будут нашим щитом против Запада!
EVT_630178_NAME;Unification of the Five Races;;;;;;;;;;X;Объединение пяти рас
EVT_630178_DESC;The day of complete unification has finally arrived! From Xinjiang to Manchuria and from Harbin to Guangzhou the five coloured flag of the republic is hoisted in celebration of what will forever on be known as the day China resurrected herself from foreign occupation and influence. Our place in the sun awaits!;;;;;;;;;;X;#TODO
EVT_630178_OPTIONA;A hard-fought victory indeed!;;;;;;;;;;X;Эта была трудная дорога к победе!
EVT_630181_NAME;The Parliamentary elections;;;;;;;;;;X;Парламентские выборы
EVT_630181_DESC;As four years have passed since the last election the country is filled with excitement and political bickering. Beijing, Nanjing, and Guangzhou are filled with posters and wall paintings proclaiming the advantages of the various parliamentary groupings. Today is a great day for democratic China, the election will prove that the revolution and defeat of the AOG, warlords, and monarchists have secured a future for the Middle Kingdom enshrined in liberty!;;;;;;;;;;X;#TODO
EVT_630181_OPTIONA;Soong Ching-ling and Zhou Shuren's Leftist Kuomintang!;;;;;;;;;;X;Сун Цинлин и Чжоу Шурен — левое крыло Гоминьдана!
EVT_630181_OPTIONB;Hu Shi's Liberals Secure a Majority!;;;;;;;;;;X;Либералы Ху Ши получили большинство!
EVT_630181_OPTIONC;Chen Jiongming's Conservatives!;;;;;;;;;;X;Консерваторы Чэнь Цзюнмина
EVT_630181_OPTIOND;The Young China Party carries the day!;;;;;;;;;;X;Младокитайская партия побеждает
EVT_630182_NAME;The Parliamentary elections;;;;;;;;;;X;Парламентские выборы
EVT_630182_DESC;As four years have passed since the last election the country is filled with excitement and political bickering. Beijing, Nanjing, and Guangzhou are filled with posters and wall paintings proclaiming the advantages of the various parliamentary groupings. Today is a great day for democratic China, the election will prove that the revolution and defeat of the AOG, warlords, and monarchists have secured a future for the Middle Kingdom enshrined in liberty!;;;;;;;;;;X;#TODO
EVT_630182_OPTIONA;Soong Ching-ling and Zhou Shuren's Leftist Kuomintang!;;;;;;;;;;X;Сун Цинлин и Чжоу Шурен — левое крыло Гоминьдана!
EVT_630182_OPTIONB;Hu Shi's Liberals Secure a Majority!;;;;;;;;;;X;Либералы Ху Ши получили большинство!
EVT_630182_OPTIONC;Chen Jiongming's Conservatives!;;;;;;;;;;X;Консерваторы Чэнь Цзюнмина
EVT_630182_OPTIOND;The Young China Party carries the day!;;;;;;;;;;X;Младокитайская партия побеждает
EVT_630183_NAME;The Elections of 1952;;;;;;;;;;X;Выборы 1944 года
